{
  "host": "cursor",
  "detect_env": {
    "env": {
      "CURSOR_AGENT": true
    },
    "argv0_contains": ["cursor"]
  },
  "capabilities": {
    "search": {
      "backend": "native",
      "tool": "WebSearch",
      "note": "Accepts a natural-language query. Include the current year when searching for recent information. Returns sourced result blocks; always carry the source URLs into the lead record."
    },
    "web_read": {
      "backend": "native",
      "tool": "WebFetch",
      "note": "Accepts a URL and returns readable markdown. Large pages may be summarized; for raw HTML, PDFs, or directory listings prefer the shell fallback. Authenticated pages are unavailable — use public sources only."
    },
    "linkedin": {
      "backend": "public_only",
      "note": "No login-gated LinkedIn access by default. Use public LinkedIn pages via web_read/shell, or a LinkedIn MCP when its session is verified. Never guess profile URLs."
    }
  },
  "permissions_hints": [
    "Bash(python3 scripts/detect_backend.py:*)",
    "Bash(python3 scripts/validate_candidates.py:*)",
    "Bash(dig +short MX:*)",
    "Bash(nslookup -type=MX:*)",
    "Bash(curl -s https://r.jina.ai/*)"
  ]
}
